{
  "format": "xregistry-document-tree",
  "formatversion": "1",
  "kind": "version",
  "entity": {
    "epoch": 1,
    "createdat": "2026-09-04T00:00:00Z",
    "modifiedat": "2026-09-04T00:00:00Z",
    "xid": "/documents/main/assets/item/versions/v2",
    "assetid": "item",
    "versionid": "v2",
    "isdefault": false,
    "ancestorid": "v1",
    "labels": {
      "stage": "development"
    },
    "contenttype": "application/octet-stream",
    "purpose": "empty"
  },
  "document": {
    "kind": "local",
    "href": "documents/n2.bin",
    "size": 0,
    "sha256": "e3b0c44298fc1c149afbf4c8996fb92427ae41e4649b934ca495991b7852b855"
  }
}
