{
  "format": "xregistry-document-tree",
  "formatversion": "1",
  "kind": "meta",
  "entity": {
    "epoch": 1,
    "createdat": "2026-09-04T00:00:00Z",
    "modifiedat": "2026-09-04T00:00:00Z",
    "xid": "/documents/main/assets/CON/meta",
    "assetid": "CON",
    "readonly": true,
    "defaultversionid": "a:b@c.",
    "defaultversionsticky": true
  }
}
